{
  "round": 9,
  "wave": "W2",
  "element": "feel-validator",
  "verdict": "FAIL",
  "bar_ref": "BAR-FEEL.md §2–§8",
  "checks": [
    {
      "id": "2.1",
      "metric": "tick_dt_variance",
      "actual": 0.0,
      "window": [
        0.0,
        0.0
      ],
      "status": "PASS"
    },
    {
      "id": "2.2",
      "metric": "replay_byte_identical",
      "actual": true,
      "window": true,
      "status": "PASS"
    },
    {
      "id": "2.3",
      "metric": "max_penetration_depth",
      "actual": 1.4210854715202004e-14,
      "window": [
        0.0,
        0.05
      ],
      "status": "PASS"
    },
    {
      "id": "2.4",
      "metric": "nan_or_inf_frames",
      "actual": 0.0,
      "window": [
        0.0,
        0.0
      ],
      "status": "PASS"
    },
    {
      "id": "3.1",
      "metric": "time_to_50pct_topspeed_s",
      "actual": 0.8,
      "window": [
        0.55,
        0.85
      ],
      "status": "PASS"
    },
    {
      "id": "3.2",
      "metric": "time_to_95pct_topspeed_s",
      "actual": 3.0166666666666666,
      "window": [
        2.6,
        3.4
      ],
      "status": "PASS"
    },
    {
      "id": "3.3",
      "metric": "top_speed_flat_us",
      "actual": 23.778530069321985,
      "window": [
        23.5,
        24.5
      ],
      "status": "PASS"
    },
    {
      "id": "3.4",
      "metric": "coast_decel_us2",
      "actual": 5.372883212033557,
      "window": [
        4.0,
        6.5
      ],
      "status": "PASS"
    },
    {
      "id": "3.5",
      "metric": "reverse_top_speed_ratio",
      "actual": 0.3999920413985864,
      "window": [
        0.3,
        0.42
      ],
      "status": "PASS"
    },
    {
      "id": "4.1",
      "metric": "drift_entry_min_speed_us",
      "actual": 10.52464672825986,
      "window": [
        9.0,
        12.0
      ],
      "status": "PASS"
    },
    {
      "id": "4.2",
      "metric": "tier1_charge_time_s",
      "actual": 0.8583333333333334,
      "window": [
        0.75,
        0.95
      ],
      "status": "PASS"
    },
    {
      "id": "4.3",
      "metric": "tier2_charge_time_s",
      "actual": 2.0083333333333337,
      "window": [
        1.9,
        2.1
      ],
      "status": "PASS"
    },
    {
      "id": "4.4",
      "metric": "tier3_charge_time_s",
      "actual": 0.0,
      "window": [
        3.3,
        3.7
      ],
      "status": "FAIL"
    },
    {
      "id": "4.5",
      "metric": "car_lengths_gained_tier2",
      "actual": 1.5191494912896797,
      "window": [
        1.5,
        2.5
      ],
      "status": "PASS"
    },
    {
      "id": "4.6",
      "metric": "car_lengths_gained_tier1",
      "actual": 0.0,
      "window": [
        0.6,
        1.1
      ],
      "status": "FAIL"
    },
    {
      "id": "4.7",
      "metric": "car_lengths_gained_tier3",
      "actual": 0.0,
      "window": [
        2.8,
        4.0
      ],
      "status": "FAIL"
    },
    {
      "id": "4.8",
      "metric": "miniturbo_duration_tier2_s",
      "actual": 1.0583333333333333,
      "window": [
        0.9,
        1.2
      ],
      "status": "PASS"
    },
    {
      "id": "4.9",
      "metric": "drift_yaw_rate_ratio",
      "actual": 1.4543830160090918,
      "window": [
        1.25,
        1.6
      ],
      "status": "PASS"
    },
    {
      "id": "4.10",
      "metric": "drift_speed_retention",
      "actual": 1.0073421097529012,
      "window": [
        0.88,
        0.97
      ],
      "status": "FAIL"
    },
    {
      "id": "5.1",
      "metric": "steer_response_lag_ms",
      "actual": 16.666666666666163,
      "window": [
        0.0,
        50.0
      ],
      "status": "PASS"
    },
    {
      "id": "5.2",
      "metric": "turn_radius_at_95pct_u",
      "actual": 8.459196166671614,
      "window": [
        7.0,
        9.5
      ],
      "status": "PASS"
    },
    {
      "id": "5.3",
      "metric": "yaw_settle_time_s",
      "actual": 0.18333333333333268,
      "window": [
        0.15,
        0.35
      ],
      "status": "PASS"
    },
    {
      "id": "5.4",
      "metric": "yaw_overshoot_ratio",
      "actual": 0.0,
      "window": [
        0.0,
        0.12
      ],
      "status": "PASS"
    },
    {
      "id": "5.5",
      "metric": "grass_speed_penalty",
      "actual": 0.0,
      "window": [
        0.55,
        0.7
      ],
      "status": "FAIL"
    },
    {
      "id": "5.6",
      "metric": "dirt_speed_penalty",
      "actual": 0.0,
      "window": [
        0.8,
        0.9
      ],
      "status": "FAIL"
    },
    {
      "id": "5.7",
      "metric": "turn_radius_at_30pct_u",
      "actual": 5.045640648639845,
      "window": [
        3.5,
        5.5
      ],
      "status": "PASS"
    },
    {
      "id": "5.8",
      "metric": "turn_radius_at_60pct_u",
      "actual": 6.916167962889011,
      "window": [
        5.5,
        7.5
      ],
      "status": "PASS"
    },
    {
      "id": "5.9",
      "metric": "turn_radius_monotonic",
      "actual": true,
      "window": true,
      "status": "PASS"
    },
    {
      "id": "6.1",
      "metric": "wall_speed_retention",
      "actual": 0.588189361783879,
      "window": [
        0.55,
        0.75
      ],
      "status": "PASS"
    },
    {
      "id": "6.2",
      "metric": "wall_head_on_retention",
      "actual": 0.19588542742629103,
      "window": [
        0.05,
        0.2
      ],
      "status": "PASS"
    },
    {
      "id": "6.3",
      "metric": "collision_recovery_time_s",
      "actual": 0.2791666666666666,
      "window": [
        0.2,
        0.45
      ],
      "status": "PASS"
    },
    {
      "id": "6.4",
      "metric": "kart_kart_impulse_symmetry",
      "actual": 0.0,
      "window": [
        0.92,
        1.08
      ],
      "status": "FAIL"
    },
    {
      "id": "6.5",
      "metric": "wall_stick_frames",
      "actual": 289.0,
      "window": [
        0.0,
        3.0
      ],
      "status": "FAIL"
    },
    {
      "id": "7.1",
      "metric": "air_control_yaw_rate_ratio",
      "actual": 0.32576546617259516,
      "window": [
        0.2,
        0.4
      ],
      "status": "PASS"
    },
    {
      "id": "7.2",
      "metric": "gravity_us2",
      "actual": 30.0,
      "window": [
        26.0,
        34.0
      ],
      "status": "PASS"
    },
    {
      "id": "7.3",
      "metric": "landing_speed_retention",
      "actual": 1.0018703340833286,
      "window": [
        0.9,
        1.0
      ],
      "status": "FAIL"
    },
    {
      "id": "7.4",
      "metric": "hard_landing_retention",
      "actual": 0.9607094897945121,
      "window": [
        0.7,
        0.85
      ],
      "status": "FAIL"
    },
    {
      "id": "7.5",
      "metric": "airborne_to_grounded_latency_ticks",
      "actual": 0.0,
      "window": [
        0.0,
        2.0
      ],
      "status": "PASS"
    },
    {
      "id": "8.1",
      "metric": "input_to_sim_latency_ticks",
      "actual": 0.0,
      "window": [
        0.0,
        1.0
      ],
      "status": "PASS"
    },
    {
      "id": "8.2",
      "metric": "input_buffer_window_ms",
      "actual": 0.0,
      "window": [
        80.0,
        130.0
      ],
      "status": "FAIL"
    },
    {
      "id": "8.3",
      "metric": "throttle_deadzone",
      "actual": 0.0,
      "window": [
        0.0,
        0.08
      ],
      "status": "PASS"
    },
    {
      "id": "8.4",
      "metric": "steer_deadzone",
      "actual": 0.0,
      "window": [
        0.05,
        0.15
      ],
      "status": "FAIL"
    }
  ],
  "largest_gap": {
    "id": "4.4",
    "delta": "actual=0, below lower bound 3.3",
    "priority_rank": 4
  },
  "artifacts": [
    "loop/round-9/artifacts/lap-a.json"
  ],
  "next_owner": "claude-code",
  "tokens_spent_on_element": 1135659,
  "budget_remaining": 0
}
