{
  "round": 24,
  "wave": "W3",
  "element": "visual-contact-sheet",
  "verdict": "FAIL",
  "bar_ref": "BAR-VISUAL.md §5",
  "checks": [
    {
      "id": "r0c0",
      "metric": "clay_score_1to5",
      "actual": 1,
      "window": [4, 5],
      "status": "FAIL"
    },
    {
      "id": "r0c1",
      "metric": "clay_score_1to5",
      "actual": 2,
      "window": [4, 5],
      "status": "FAIL"
    },
    {
      "id": "r1c0",
      "metric": "clay_score_1to5",
      "actual": 1,
      "window": [4, 5],
      "status": "FAIL"
    },
    {
      "id": "r1c1",
      "metric": "clay_score_1to5",
      "actual": 1,
      "window": [4, 5],
      "status": "FAIL"
    },
    {
      "id": "r2c0",
      "metric": "clay_score_1to5",
      "actual": 1,
      "window": [4, 5],
      "status": "FAIL"
    },
    {
      "id": "r2c1",
      "metric": "clay_score_1to5",
      "actual": 1,
      "window": [4, 5],
      "status": "FAIL"
    },
    {
      "id": "r3c0",
      "metric": "clay_score_1to5",
      "actual": 1,
      "window": [4, 5],
      "status": "FAIL"
    },
    {
      "id": "r3c1",
      "metric": "clay_score_1to5",
      "actual": 4,
      "window": [4, 5],
      "status": "PASS"
    },
    {
      "id": "r4c0",
      "metric": "clay_score_1to5",
      "actual": 3,
      "window": [4, 5],
      "status": "FAIL"
    },
    {
      "id": "r4c1",
      "metric": "clay_score_1to5",
      "actual": 1,
      "window": [4, 5],
      "status": "FAIL"
    },
    {
      "id": "r5c0",
      "metric": "clay_score_1to5",
      "actual": 4,
      "window": [4, 5],
      "status": "PASS"
    },
    {
      "id": "r5c1",
      "metric": "clay_score_1to5",
      "actual": 1,
      "window": [4, 5],
      "status": "FAIL"
    }
  ],
  "largest_gap": {
    "id": "r0c0",
    "delta": "右側為空白灰底佔位框（1），左側才呈現可辨識的圓潤霧面黏土屑（4），是本批單一最大視覺落差。",
    "priority_rank": 1
  },
  "artifacts": ["contact-sheet.png"],
  "next_owner": "lead",
  "tokens_spent_on_element": 0,
  "budget_remaining": 0
}
