{
  "round": 21,
  "wave": "W3",
  "element": "visual-contact-sheet",
  "verdict": "FAIL",
  "bar_ref": "BAR-VISUAL.md §1, §5",
  "checks": [
    {
      "id": "kart-body",
      "metric": "clay_score_1to5",
      "actual": 4,
      "window": [4, 5],
      "status": "PASS"
    },
    {
      "id": "kart-wheels",
      "metric": "clay_score_1to5",
      "actual": 4,
      "window": [4, 5],
      "status": "PASS"
    },
    {
      "id": "driver-face",
      "metric": "clay_score_1to5",
      "actual": 4,
      "window": [4, 5],
      "status": "PASS"
    },
    {
      "id": "track-surface",
      "metric": "clay_score_1to5",
      "actual": 1,
      "window": [4, 5],
      "status": "FAIL"
    },
    {
      "id": "track-barriers",
      "metric": "clay_score_1to5",
      "actual": 1,
      "window": [4, 5],
      "status": "FAIL"
    },
    {
      "id": "foliage",
      "metric": "clay_score_1to5",
      "actual": 1,
      "window": [4, 5],
      "status": "FAIL"
    },
    {
      "id": "skybox-lighting",
      "metric": "clay_score_1to5",
      "actual": 1,
      "window": [4, 5],
      "status": "FAIL"
    },
    {
      "id": "drift-sparks",
      "metric": "clay_score_1to5",
      "actual": 1,
      "window": [4, 5],
      "status": "FAIL"
    },
    {
      "id": "item-boxes",
      "metric": "clay_score_1to5",
      "actual": 1,
      "window": [4, 5],
      "status": "FAIL"
    },
    {
      "id": "shadows-contact",
      "metric": "clay_score_1to5",
      "actual": 1,
      "window": [4, 5],
      "status": "FAIL"
    },
    {
      "id": "water-sea",
      "metric": "clay_score_1to5",
      "actual": 1,
      "window": [4, 5],
      "status": "FAIL"
    },
    {
      "id": "ui-hud",
      "metric": "clay_score_1to5",
      "actual": 1,
      "window": [4, 5],
      "status": "FAIL"
    }
  ],
  "largest_gap": {
    "id": "track-surface",
    "delta": "12 個元件有 9 個尚未實作，contact sheet 的那一半是空白 placeholder。三個已實作的元件全部達到門檻，最大落差不在品質而在覆蓋率——依 budget.json 的 W3 順序，下一個是 track-surface。",
    "priority_rank": 1
  },
  "artifacts": [
    "loop/round-21/artifacts/contact-sheet.png",
    "loop/round-21/CRITIC-NOTES.md"
  ],
  "next_owner": "claude-code",
  "tokens_spent_on_element": 0,
  "budget_remaining": 0
}
