{
  "round": 33,
  "wave": "W2",
  "element": "perf-validator",
  "verdict": "FAIL",
  "bar_ref": "BAR-PERF.md §2–§5; §4.1 mode=hz_12_window",
  "checks": [
    {
      "id": "4.1",
      "metric": "character_anim_hz",
      "actual": 12.136397447441347,
      "window": [
        11.5,
        12.5
      ],
      "status": "PASS"
    },
    {
      "id": "4.2",
      "metric": "vehicle_transform_hz",
      "actual": 60.094742199427316,
      "window": [
        58.0,
        62.0
      ],
      "status": "PASS"
    },
    {
      "id": "4.3",
      "metric": "camera_hz",
      "actual": 60.094742199427316,
      "window": [
        58.0,
        62.0
      ],
      "status": "PASS"
    },
    {
      "id": "2.1",
      "metric": "fps_p50",
      "actual": 59.8802395219599,
      "window": [
        58.0,
        62.0
      ],
      "status": "PASS"
    },
    {
      "id": "2.2",
      "metric": "fps_p05",
      "actual": 58.8235294117647,
      "window": [
        55.0,
        62.0
      ],
      "status": "PASS"
    },
    {
      "id": "5.2",
      "metric": "heap_growth_per_lap_mb",
      "actual": 0.0,
      "window": [
        0.0,
        2.0
      ],
      "status": "FAIL"
    },
    {
      "id": "2.3",
      "metric": "frame_time_p99_ms",
      "actual": 17.595000000088476,
      "window": [
        0.0,
        22.0
      ],
      "status": "PASS"
    },
    {
      "id": "2.4",
      "metric": "long_frame_count",
      "actual": 0.0,
      "window": [
        0.0,
        3.0
      ],
      "status": "PASS"
    },
    {
      "id": "2.5",
      "metric": "gc_pause_max_ms",
      "actual": 0.938,
      "window": [
        0.0,
        8.0
      ],
      "status": "PASS"
    },
    {
      "id": "3.1",
      "metric": "first_interactive_s",
      "actual": 0.08609999999962747,
      "window": [
        0.0,
        3.0
      ],
      "status": "PASS"
    },
    {
      "id": "3.2",
      "metric": "initial_bundle_kb_gz",
      "actual": 153.7890625,
      "window": [
        0.0,
        900.0
      ],
      "status": "PASS"
    },
    {
      "id": "3.3",
      "metric": "total_assets_mb",
      "actual": 3.496975898742676,
      "window": [
        0.0,
        12.0
      ],
      "status": "PASS"
    },
    {
      "id": "3.4",
      "metric": "time_to_first_render_s",
      "actual": 1.3152000000001862,
      "window": [
        0.0,
        1.5
      ],
      "status": "PASS"
    },
    {
      "id": "5.1",
      "metric": "heap_peak_mb",
      "actual": 15.917259216308594,
      "window": [
        0.0,
        320.0
      ],
      "status": "PASS"
    },
    {
      "id": "5.3",
      "metric": "draw_calls",
      "actual": 148.0,
      "window": [
        0.0,
        150.0
      ],
      "status": "PASS"
    },
    {
      "id": "5.4",
      "metric": "triangles_k",
      "actual": 58.754,
      "window": [
        0.0,
        400.0
      ],
      "status": "PASS"
    },
    {
      "id": "5.5",
      "metric": "texture_memory_mb",
      "actual": 4.9169158935546875,
      "window": [
        0.0,
        96.0
      ],
      "status": "PASS"
    }
  ],
  "largest_gap": {
    "id": "5.2",
    "delta": "actual=missing; measurement required",
    "priority_rank": 3
  },
  "artifacts": [
    "/private/tmp/claude-501/-Users-godmosword-eth-Downloads-clay-kart/543845d5-4bc1-4711-8a9c-51e80103d269/scratchpad/r33-lead-verify.json"
  ],
  "next_owner": "claude-code",
  "tokens_spent_on_element": 0,
  "budget_remaining": 0
}
